"review-data href","audience-reviews__name","audience-reviews__name href","audience-reviews__duration","weapons_reviews"
"https://www.rottentomatoes.com/profiles/mo6tadsJvfV3U6dFJotqLuJXIGGcRjHjxfm1hq8Fmmc5qtYDh0Jtbdfzzc06CkQSBGH2pC22cx9um2hXdfRJIMYFvRSXLCzAh2pcmphkVCg2","BraydenTCT","https://www.rottentomatoes.com/profiles/mo6tadsJvfV3U6dFJotqLuJXIGGcRjHjxfm1hq8Fmmc5qtYDh0Jtbdfzzc06CkQSBGH2pC22cx9um2hXdfRJIMYFvRSXLCzAh2pcmphkVCg2","Dec 19, 2023","Terrible movie. Don't get me wrong, good action scenes, good acting and lots of plot twists. But that doesn't make a good Star Wars movie. A Star Wars movie has to be special and creative, and this movie lacks all creativity and specialness. I hate what this franchise has become and I hate how there was a director change midway through the series because now the trilogy is all over the place. I wish the makers of these movies knew how to read an audience and actually make a good movie."
"https://www.rottentomatoes.com/profiles/dagIpkfkMux5hGEUOoI8EU96tkkc7whBOIRnSJgF11cn7tDvULoHERU11c8WFN7f3otvRt99ckPh5gSadUEdFQRF09f2YIVYukAhkKuW0iQY","Sebastian L","https://www.rottentomatoes.com/profiles/dagIpkfkMux5hGEUOoI8EU96tkkc7whBOIRnSJgF11cn7tDvULoHERU11c8WFN7f3otvRt99ckPh5gSadUEdFQRF09f2YIVYukAhkKuW0iQY","Dec 16, 2023","The Rise of Skywalker makes haste through what barely constitutes as a script. When it comes to tone, characters and story this is really just any rushed out action/space adventure, and the only thing that makes it Star Wars is the useage of familiar names and locations. In all honesty, this is barely watchable."
"https://www.rottentomatoes.com/profiles/J97cA5SWRfP2SBOikMUYVCMDc77cPMhpNsB3tN9INNcRet6DFNAI8YFDDck8FeqtAnC6GU33cQRsgVF7wIo2Fv6u6PsVqtQGUdxiP6UBGHQv","Leon W","https://www.rottentomatoes.com/profiles/J97cA5SWRfP2SBOikMUYVCMDc77cPMhpNsB3tN9INNcRet6DFNAI8YFDDck8FeqtAnC6GU33cQRsgVF7wIo2Fv6u6PsVqtQGUdxiP6UBGHQv","Dec 16, 2023","I loved this movie. As a culmination of the Skywalker saga with Palpatine returning as the villain I was very happy. Brilliant performances from Ian McDiarmid, Daisy Ridley and Adam Driver."
"https://www.rottentomatoes.com/profiles/R0ehYQtk0UGaINQsQbsRVheXS00cAbfEAukzHxgcvvc2qt2eUXxujASqqcgquLnhOvSbLuYYcKkuqAfDqI2kUP5u8YcvMu6Aha6hvRhWGcqz","The F","https://www.rottentomatoes.com/profiles/R0ehYQtk0UGaINQsQbsRVheXS00cAbfEAukzHxgcvvc2qt2eUXxujASqqcgquLnhOvSbLuYYcKkuqAfDqI2kUP5u8YcvMu6Aha6hvRhWGcqz","Nov 28, 2023","Palpatine is my fave Star Wars character - but even he is butchered in this."
"https://www.rottentomatoes.com/profiles/wkGsPztbwSaBhM9fYOHV6TA7HEEcpjiPqI4AtEYT66cpVtWAfvdta3SLLcGPhM5IWxiYvuPPcqvu3guqjS9BiMNfL9t8Xfv1uBkFmYFxaUY8","Jorge R","https://www.rottentomatoes.com/profiles/wkGsPztbwSaBhM9fYOHV6TA7HEEcpjiPqI4AtEYT66cpVtWAfvdta3SLLcGPhM5IWxiYvuPPcqvu3guqjS9BiMNfL9t8Xfv1uBkFmYFxaUY8","Nov 28, 2023","Better, but the writing is still pretty bad."
"https://www.rottentomatoes.com/profiles/JzLsG8uW8IPbh0AckBHYPcMoF77cP6FV3hBbU4WsNNcRetbdsNAI8zfDDcPaFwBi5Et67H33cQeUg8H7Pio8t7gtXbuVYhP7FN7I3JcBJIQk","Adam E","https://www.rottentomatoes.com/profiles/JzLsG8uW8IPbh0AckBHYPcMoF77cP6FV3hBbU4WsNNcRetbdsNAI8zfDDcPaFwBi5Et67H33cQeUg8H7Pio8t7gtXbuVYhP7FN7I3JcBJIQk","Nov 28, 2023","The final chapter in the Star Wars sequel trilogy, The Rise Of Skywalker sees J.J. Abrams back on directing duties since The Force Awakens as the story of new characters Rey, Finn, Poe and Kylo Ren draws to a close in typically epic fashion.

With the mixed reaction second chapter The Last Jedi prompted back in 2017, there seemed to be a conscious effort by Disney to regroup somewhat, especially after the disappointing reception of Solo: A Star Wars Story the following year. The Rise Of Skywalker had to be either universally beloved or, at the very least, satisfying as an ending to most Star Wars fans to make this regrouping worthwhile. From its opening text crawl, this sequel already appears to make a conscious jump past The Last Jedi and back onto more familiar territory with the reintroduction of Emperor Palpatine (Ian McDiarmid) and Rey's plot focusing even more on her origins.

""The dead speak!"", we are told, moments before Kylo Ren (Adam Driver) travels solo to The Emperor's lair, an old-school mad scientist lab complete with half-finished Supreme Leader Snoke clones in water tanks (lol), screaming lightning (I'm not kidding) and big magnifying glasses everywhere (still not kidding). Palpatine is every bit as over-the-top as you'd expect and the overall tone here is reminiscent of old horror B-movies, which certainly could have been apt seeing as the likes of horror giants Christopher Lee and Peter Cushing were once a big part of this franchise. Unfortunately, the Palpatine scenes are where all this begins and ends, and all that remains is the nagging feeling that these tonal shifts and this apparently random reviving of Emperor Palpatine might not actually work.

""Somehow the Emperor's back!"", Poe Dameron (Oscar Isaac) exclaims at one point in the movie, with the word ""somehow"" doing a heck of a lot of heavy lifting here. And this is a good way to understand what's... off about this movie: somehow most of The Last Jedi isn't so important now, somehow Rose isn't a main character anymore, somehow Lando Calrissian's back and he has the entire world on speed-dial, somehow Force healing is a big thing all of a sudden, somehow The Emperor is ALL the Siths, somehow Rey has mastered every power by running in the woods, and so on.

Not that the film never explains anything but there is a lot it, indeed, doesn't explain and, in fact, the overall pacing of this installment feels extremely rushed and J.J. Abrams' erratic, perhaps more Star Trek-friendly, direction is mostly to blame for this. 

Fortunately, after a frankly clunky first act, we are given a solid second act that's genuinely entertaining and should keep the attention of even the grumpiest Star Wars fan. Rey wrestles with the good and the bad within her as Kylo Ren closes in, C3P0 (Anthony Daniels doing great work, as usual) becomes key to the Resistance's success, Poe reveals his darker past and there are some fun action sequences along the way. Fair homage is paid to the late Carrie Fisher and there are some enjoyable enough, if gimmicky cameos here and there. Sadly, brand new characters like Richard E. Grant's Allegiant General Pryde and Naomi Ackie's Jannah aren't given much to work with and the likes of Rose (Kelly Marie Tran) and Maz (Lupita Nyong'o) are criminally cast aside, as if there was never any plan for them.

The softening of The Last Jedi's bolder ideas hurts this movie which, too often, feels like a cowardly retreat into safer territory, actual drama be damned. There are elements explored here that do work, admittedly: the closing of Kylo Ren's character arc is mostly effective and it's rewarding to see Ben Solo being himself, even for a brief moment, while Poe and Finn collaborating as the new leaders of the Resistance makes sense. There are also some good ideas in there like Rey potentially killing Chewbacca by mistake or C3P0 tragically losing his memory to save his friends' lives but the film refuses to actually go there and undoes all this within minutes, perhaps for fear of offending a single die-hard fan who might tweet negatively about all of this or for fear of instilling real emotions into the movie.

Truthfully, this feels like a film based on an older script that was reworked much later on with lots of unclear ideas thrown in and shadows of better prior ideas still visible, but only just. The writing as a whole, by the way, is rather weak especially when it comes to the dialog, but we've seen this many times before in the Star Wars franchise so it's almost to be expected at this point. Though it's never all that welcome.

This is a fast-paced movie that does everything you'd expect in a Star Wars film, Ewoks even pop up briefly, but it doesn't so much feel like the end of an epic trilogy as it does the final breath of a rebooted franchise that was not carefully worked-out from the beginning and can't wait to end once and for all. Some of it is fan-service, some of it is almost stream of consciousness, none of it feels quite right but, at the very least, it's never dull. 

Missed opportunity, this was."
"https://www.rottentomatoes.com/profiles/Ln6uQMIj2h6dHa9HPaSDXh6XUJJcBRI9YinacMLUbbcwjt4OI1DI2eTMMcKnhW8uNKUJNsLLcRJIMgFjJcv4U0Gt7WhxkC54spdFAEcJ2Iog","Yaniv P","https://www.rottentomatoes.com/profiles/Ln6uQMIj2h6dHa9HPaSDXh6XUJJcBRI9YinacMLUbbcwjt4OI1DI2eTMMcKnhW8uNKUJNsLLcRJIMgFjJcv4U0Gt7WhxkC54spdFAEcJ2Iog","Nov 26, 2023","its funny really. the user score is opposite to the critic score. even when pretty much everyone agree this is a bad movie. and it is. but just because you hated last jedi and the critics loved it and now when the critics hate it you upvote this trash? lol. its really shows that star wars fans are man-babies. just because last jedi is bad does not make this one good. in fact. i would say as someone who only like force awakens that both this one and last jedi are bad. who is worse? this one probably. last jedi at least had some balls to its script. this one? ray is the granddoughter of palpatine? wtf? thats makes the star wars universe incredibly small. in huge galaxy its only the story of 2 families? lol. but yes there is some good one and that is rouge one. rouge one was pretty much the best star wars movie since revenge of the sith."
"https://www.rottentomatoes.com/profiles/wDdsPmFb3tpMfMpt2zCOeuAXtEEcpjiPWU4AtVas66cpVtW1UvGHKXSLLcGvFMqtWMhY5hPPcqvu3GUqjS5DHMDUoOi0NhvOhBOhPBUbGC53","Dean L","https://www.rottentomatoes.com/profiles/wDdsPmFb3tpMfMpt2zCOeuAXtEEcpjiPWU4AtVas66cpVtW1UvGHKXSLLcGvFMqtWMhY5hPPcqvu3GUqjS5DHMDUoOi0NhvOhBOhPBUbGC53","Nov 25, 2023","Not just a terrible Star Wars film, but one of the worst movies I've ever seen."
"https://www.rottentomatoes.com/profiles/nJdfe5UvbuYNTLYHALu9bf1VszzcPJIRmSgxUWLu77cvAt2nTBzUXLibbcpLFnoc2Vh81FeecEqSYXF80hoxUqdFagSnEIzLIqnHRbFaVUDM","Kleber C","https://www.rottentomatoes.com/profiles/nJdfe5UvbuYNTLYHALu9bf1VszzcPJIRmSgxUWLu77cvAt2nTBzUXLibbcpLFnoc2Vh81FeecEqSYXF80hoxUqdFagSnEIzLIqnHRbFaVUDM","Nov 13, 2023","Mesmo sendo criticado por fãs presos a trilogia original, o filme tem uma qualidade ímpar em efeitos especiais e uma criatividade excelente no conjunto do filme!"
"https://www.rottentomatoes.com/profiles/493HqNS7QUY3hn6cWVUgkF1XtoocXGTAVfdbuOKSNNc13tE2hjPI5KFNNcYguvKUbmsDdh66c2eHYNU2ASWpSNEFYmuPeU7VF4ouxKh75sPa","Jack M","https://www.rottentomatoes.com/profiles/493HqNS7QUY3hn6cWVUgkF1XtoocXGTAVfdbuOKSNNc13tE2hjPI5KFNNcYguvKUbmsDdh66c2eHYNU2ASWpSNEFYmuPeU7VF4ouxKh75sPa","Nov 5, 2023","I really liked the movie, only thing is that it was a bit confusing and often I found that they would find a problem, only to solve it in the next scene."
"https://www.rottentomatoes.com/profiles/daMF4VTkqhqafPgSOGU5Eu9Pfkkc6GfBmtAKS9Nf11cn7tDBtq7uO0C11cOwFv3C3Qf09u99coxF9qSaYhEoU9mC0pI2XSV2ckJIkqCYLIDY","Adam B","https://www.rottentomatoes.com/profiles/daMF4VTkqhqafPgSOGU5Eu9Pfkkc6GfBmtAKS9Nf11cn7tDBtq7uO0C11cOwFv3C3Qf09u99coxF9qSaYhEoU9mC0pI2XSV2ckJIkqCYLIDY","Nov 2, 2023","I almost walked out of this movie. I've wonder why we have not seen any interviews with JJ Abrams since this movie. Maybe someone can point me in the right direction, I'd love to know some behind-the-scene details on how this movie got to this level of awful."
"https://www.rottentomatoes.com/profiles/EWgHKEsk4cnwsY1ILXUjgfBoFaacvjHobsnxU8MsVVcQKtgjt65HdvuzzcQRuWAhOwCDqsOOcW9hmMtGRILdcgQCMOhQMcBohq2FeoheYU9E","Tim R","https://www.rottentomatoes.com/profiles/EWgHKEsk4cnwsY1ILXUjgfBoFaacvjHobsnxU8MsVVcQKtgjt65HdvuzzcQRuWAhOwCDqsOOcW9hmMtGRILdcgQCMOhQMcBohq2FeoheYU9E","Nov 2, 2023","Star Wars comes to an epic and satisfying
conclusion in The Rise of Skywalker
which has Rey facing Palpatine 
and Ben and Hux turning sides from the bad guys side.
A sensational desert chase you'll want to watch over and over!
Everyone has fun with their characters and locations are a sight!
The Rise of Skywalker is an adventure you'll want to experience again and again!"
"https://www.rottentomatoes.com/profiles/XjRHD2hgDHX9FXqTW6UpNFGnIVVcN5FMRtdquMKSOOcNoto0Ie4cv4ueecj3h71fpGc2Yu11c8ATPNhAmFagfpVHgWUqjtYoioXu7pUg6FpX","Vovo C","https://www.rottentomatoes.com/profiles/XjRHD2hgDHX9FXqTW6UpNFGnIVVcN5FMRtdquMKSOOcNoto0Ie4cv4ueecj3h71fpGc2Yu11c8ATPNhAmFagfpVHgWUqjtYoioXu7pUg6FpX","Oct 25, 2023","The absolute worst. Inconsistent, unlikeable, no character growth."
"https://www.rottentomatoes.com/profiles/1KOHxMS65iozhg6udwFPDSb8SGGcKni83hgnu0YhDDczotaRCaohRgfLLcb7FVNFX2tjRtVVc54tBQHx3sWMcLAhwbugLHo4hBEu4PUY5fvR","Fetti","https://www.rottentomatoes.com/profiles/1KOHxMS65iozhg6udwFPDSb8SGGcKni83hgnu0YhDDczotaRCaohRgfLLcb7FVNFX2tjRtVVc54tBQHx3sWMcLAhwbugLHo4hBEu4PUY5fvR","Oct 20, 2023","It doesn't do a whole lot for the already bland, unoriginal, plain awful new trilogy of Star Wars. But the increase in action and the return of a badass, terrifying villain did this installation a lot of good."
"https://www.rottentomatoes.com/profiles/94bTwXSdvFwpUdVtb8FPXspBfnncWAC65swNhA9teecY2tEgFp1t7EuQQcWYhKEIvMsmbUYYcAdtdzuKYuqvIoMh4Ntk2CzXf7KuqwhPdIRX","Matthew P","https://www.rottentomatoes.com/profiles/94bTwXSdvFwpUdVtb8FPXspBfnncWAC65swNhA9teecY2tEgFp1t7EuQQcWYhKEIvMsmbUYYcAdtdzuKYuqvIoMh4Ntk2CzXf7KuqwhPdIRX","Oct 17, 2023","The characters aren't themselves, but It was an overall good conclusion to Star Wars."
"https://www.rottentomatoes.com/profiles/ngRieEsvDcO9UL9S08I9wI1mHzzcPJIRgtgxUWgh77cvAt2eiBXuMeSbbc6qfnKiPbU8xSeecWgiYdI8WToxUqQhm6FQ9izQFqNsRbFEMhge","Gregory V","https://www.rottentomatoes.com/profiles/ngRieEsvDcO9UL9S08I9wI1mHzzcPJIRgtgxUWgh77cvAt2eiBXuMeSbbc6qfnKiPbU8xSeecWgiYdI8WToxUqQhm6FQ9izQFqNsRbFEMhge","Oct 16, 2023","This is easily one of the worst movies I've ever seen."
"https://www.rottentomatoes.com/profiles/bjmuMGSnaua2Fo6hmLU9dU94UBBcw1FeDt3KuE0ILLcJptOzcgAsNGUxxc3WuDXtWzt34FPPcNof5PIYxsLEtwJt9qSVEhEjF7bFoXhD2u4w","Carlos S","https://www.rottentomatoes.com/profiles/bjmuMGSnaua2Fo6hmLU9dU94UBBcw1FeDt3KuE0ILLcJptOzcgAsNGUxxc3WuDXtWzt34FPPcNof5PIYxsLEtwJt9qSVEhEjF7bFoXhD2u4w","Oct 15, 2023","Although episode 9 is more entertaining than the mess of episode 8, it is not so far from competing with the previous one mentioned for who is the worst in the saga.

If the previous one took away the development of the characters, in this one apart from that it also did it with the canon, how to revive Palpatine, that Rey without training is more powerful than the Jedi masters themselves, that she can now heal wounds with the force , that ghosts can touch things and use force and much more.

And not even the fanservice is well done, since only the voices of the ancient Jedi appear but not in ghosts, that Palpatine goes from starring in one of the best Star Wars deaths in episode 6 to the most pathetic and meaningless of the Saga , or that it was the ghost of Han Solo that convinced Kylo to turn to the light side, when it would be more logical for it to be Anakin...

And well, despite that I give him a star, because there was only ONE who did his job well, the great John Williams..."
"https://www.rottentomatoes.com/profiles/LjLiQjhJPSnNSaRtP4h7XH6guJJcBeS9kcebt1LHbbcwjtgpHW8I2MiMMcKwFe3cwOCj5tLLcKMuMgFjeiwzi54t7Luxgi5eUadHABubpCow","Claire B","https://www.rottentomatoes.com/profiles/LjLiQjhJPSnNSaRtP4h7XH6guJJcBeS9kcebt1LHbbcwjtgpHW8I2MiMMcKwFe3cwOCj5tLLcKMuMgFjeiwzi54t7Luxgi5eUadHABubpCow","Oct 15, 2023","This movie spat on the legacy of George Lucas and made the Anakin's sacrifice pointless. The only thing this movie succeeded at was being a complete disgrace from top to bottom."
"https://www.rottentomatoes.com/profiles/jEGhzEC45cN8H47h71t12skmSvvcKJumPfOYFe0FVVcG4toptvQs3WsAAcBKuoqCPKspPc33cN6FRbF7AcApH3bIB7seDt6eHdasJYFgwU7v","cato k","https://www.rottentomatoes.com/profiles/jEGhzEC45cN8H47h71t12skmSvvcKJumPfOYFe0FVVcG4toptvQs3WsAAcBKuoqCPKspPc33cN6FRbF7AcApH3bIB7seDt6eHdasJYFgwU7v","Oct 15, 2023","It is a decent movie, some things are messy indeed. But i loved it"
"https://www.rottentomatoes.com/profiles/We6uzPuK6IBNskEs5WhDYuLpUPPcDafd2umAF6mTzzcgKtN3snVuAms00cjNhdku8Dsveu66c8ET0js9GFxafWKfwDFwBC3jH83UBEFMbcVv","Alec B","https://www.rottentomatoes.com/profiles/We6uzPuK6IBNskEs5WhDYuLpUPPcDafd2umAF6mTzzcgKtN3snVuAms00cjNhdku8Dsveu66c8ET0js9GFxafWKfwDFwBC3jH83UBEFMbcVv","Oct 13, 2023","Easily the weakest film in the ""Star Wars"" saga so far. Abrams and company seemingly tried to make something that would temper the anger felt by some fans over ""The Last Jedi"" but trying to appease so many conflicting encampments while also closing out three whole trilogies (and introducing a major twist) means that there's no time to explain anything or let any emotional moments really land. Honestly I do not understand why they didn't delay this movie to put the work in that the screenplay clearly needed . . . I mean the answer is money but still."
"https://www.rottentomatoes.com/profiles/DDbT39T1WcWnfAqTGAUPNu0mfzzcPesR3hn5fXohPPcOztmos1xsGefzzc7AtaDhL7FD7I22c52uPefRVI2RI5dSWeheXiMDs6zHENFPaiKN","Leonardo S","https://www.rottentomatoes.com/profiles/DDbT39T1WcWnfAqTGAUPNu0mfzzcPesR3hn5fXohPPcOztmos1xsGefzzc7AtaDhL7FD7I22c52uPefRVI2RI5dSWeheXiMDs6zHENFPaiKN","Oct 13, 2023","Malisima, nos regaló el peor beso de la historia, el más incómodo y el más innecesario, sin duda una de las peores películas no solo de Star Wars si no del cine de ciencia ficción de gran presupuesto."
"https://www.rottentomatoes.com/profiles/K1BCALfBvContARCNmCm8h2Puddc6otxVu53UzNhxxcj4tB4cQMcVeheeckEh7VtQoFWphYYcJQuGaHwvuQjFn0u4bh17sWqiaJHa8i6OU0o","Michael S","https://www.rottentomatoes.com/profiles/K1BCALfBvContARCNmCm8h2Puddc6otxVu53UzNhxxcj4tB4cQMcVeheeckEh7VtQoFWphYYcJQuGaHwvuQjFn0u4bh17sWqiaJHa8i6OU0o","Oct 10, 2023","The movie reminded me of a Road Runner cartoon."
"https://www.rottentomatoes.com/profiles/8J4FAos6AheosgVCJPugKiRYf77coef19tEbsGwsxxcAKt1zFk8UD2CEEcnbupEF3GuL5SQQcEeugeU3nHagfpjiKPueBs7VHx2HW6tobSLe","Ana Q","https://www.rottentomatoes.com/profiles/8J4FAos6AheosgVCJPugKiRYf77coef19tEbsGwsxxcAKt1zFk8UD2CEEcnbupEF3GuL5SQQcEeugeU3nHagfpjiKPueBs7VHx2HW6tobSLe","Oct 6, 2023","There are not enough rotten tomatoes to describe how awful this movie was. They killed the context of what a Star Wars movie means. This movie includes A very bad dialogue and boring new charters. But it ends with the same bad guy of all the previous movies. A failure of a great franchise."
"https://www.rottentomatoes.com/profiles/4pniqWsv1FDkHnWiW4hQws15hoocBAuA5tdLHOofNNc13tEVijmSG7fNNcwmhvMHw6F8qs66cKmsp3F4vIWjsN2UwoiP4H7QuvAFNbfYpu9K","JG B","https://www.rottentomatoes.com/profiles/4pniqWsv1FDkHnWiW4hQws15hoocBAuA5tdLHOofNNc13tEVijmSG7fNNcwmhvMHw6F8qs66cKmsp3F4vIWjsN2UwoiP4H7QuvAFNbfYpu9K","Oct 6, 2023","This is nonsense unfortunately."
"https://www.rottentomatoes.com/profiles/da3spDIkWHqeIG5uOmF56I7PIkkc6RIwOfRbs9wt11cn7tPzcq2hEPS11c8AhNWs3bI09u99ckbs9qSaYhE5t9Rhe5h2YIAGUW0igXIYxfDL","Dexex","https://www.rottentomatoes.com/profiles/da3spDIkWHqeIG5uOmF56I7PIkkc6RIwOfRbs9wt11cn7tPzcq2hEPS11c8AhNWs3bI09u99ckbs9qSaYhE5t9Rhe5h2YIAGUW0igXIYxfDL","Oct 2, 2023","A complete mess with no originality or stakes.  A betrayal to the Star Wars universe and it's baffling it has a higher rating then movies like ROTS."
"https://www.rottentomatoes.com/profiles/YJ0f4bTQOiEnS8MfvWFzYCORSaacJ3uAahnMuYDFddcNetmbHaBF9pt22cQWu3wUPAhKWhVVc4et18h3ahYLHWPFmBsnBHB8UB0C7GURPi05","Pedro B","https://www.rottentomatoes.com/profiles/YJ0f4bTQOiEnS8MfvWFzYCORSaacJ3uAahnMuYDFddcNetmbHaBF9pt22cQWu3wUPAhKWhVVc4et18h3ahYLHWPFmBsnBHB8UB0C7GURPi05","Oct 2, 2023","Bom mas podia ser melhor"
"https://www.rottentomatoes.com/profiles/NjPFo2hD7FEaC8xtEdfMLcdnteecn2uQMfRdI0vFYYcOatMPs2OS9xHqqc0PFBvFbqi1os99cKvF64HWMc0QtLpIJqI75codhP1cBnFwRC2w","Joe M","https://www.rottentomatoes.com/profiles/NjPFo2hD7FEaC8xtEdfMLcdnteecn2uQMfRdI0vFYYcOatMPs2OS9xHqqc0PFBvFbqi1os99cKvF64HWMc0QtLpIJqI75codhP1cBnFwRC2w","Oct 2, 2023","The first half of the movie is about searching for the sith navigation? Really? A whole hour for just that? Man, I never felt asleep in the first six instalments (include TFA) that's first seven instalments.

Too much emotional scenes those are not in necessary. Is this a space action-adventure movie or love story? Like a couple arguing between Kylo n Rey from the start to the end, I don't feel the excitement in the whole movie.

Finally, where is the epic lightsabre fight?! Their fighting styles are like chopping chicken with the sabre. Is there even a fighting art director?"
"https://www.rottentomatoes.com/profiles/DDgc3PSxOhWEFAncGxsB1S0atzzcP3HB1tnNhX9tPPcOztmNhdgfGDuzzc4QhaDhLjsDPf22c5zhPnSRVI29t5RtgbIoxfMJuA4UKGUzRhKM","Hitler","https://www.rottentomatoes.com/profiles/DDgc3PSxOhWEFAncGxsB1S0atzzcP3HB1tnNhX9tPPcOztmNhdgfGDuzzc4QhaDhLjsDPf22c5zhPnSRVI29t5RtgbIoxfMJuA4UKGUzRhKM","Oct 1, 2023","the ending its very bad why rey says that her lastname its skywalker that its not possible"
"https://www.rottentomatoes.com/profiles/qOeH1nsD0FY1sV8H4XFq3FemS99c8WTA6UmYSeKs11cwat6oTnjFwzt11cabuq4Sm2Hw8sKKcaeHmAfEGsO5S92H2QU1Ki9AIo2tNOC3Psjz","Jonathan M","https://www.rottentomatoes.com/profiles/qOeH1nsD0FY1sV8H4XFq3FemS99c8WTA6UmYSeKs11cwat6oTnjFwzt11cabuq4Sm2Hw8sKKcaeHmAfEGsO5S92H2QU1Ki9AIo2tNOC3Psjz","Sep 26, 2023","I'm being generous in giving this movie a 1.5 star rating because there was nothing Abrams could have done to salvage the sequel trilogy after The Last Jedi. Even taking that into account, this movie relies on contrivance and macguffins for nearly every plot point. And (spoiler alert), brining back Palpatine was both lazy AND decreases the stakes of his defeat in the original trilogy. I wish this movie could be retconned, but at this point, the damage is done."
"https://www.rottentomatoes.com/profiles/zRaid1u4EhOxiB0Hx6HGgIweikkcJBT4of89IVbUPPcAxtjRceot0giGGcXqFPBFE1uJxc22c8eSjpI45UQPUpWu1Bh9nUBqce2hpnu97HEj","","","Sep 24, 2023","One of the worst movies I've seen in my life. “Somehow” Palpatine survived?? The very basis for the plot of this movie is an insult to our intelligence."
"https://www.rottentomatoes.com/profiles/EWgHKdUE3tn6tR8FgEhjVsVwSaacvbSNQunVSQXUVVcQKtgOF6LsjvhzzcQDFKBIgLFKmiOOcWJuaViPYF98Hg4F3Lf6Yf6puqWC6WHeGI93","Cluedo","https://www.rottentomatoes.com/profiles/EWgHKdUE3tn6tR8FgEhjVsVwSaacvbSNQunVSQXUVVcQKtgOF6LsjvhzzcQDFKBIgLFKmiOOcWJuaViPYF98Hg4F3Lf6Yf6puqWC6WHeGI93","Sep 23, 2023","The best out of the sequels but still bad.
Great visuals but thats it"
"https://www.rottentomatoes.com/profiles/K1ksARI60fo8SWXSQDHV5S2zSddc6otxoH5wszdFxxcj4tXnuDphmKFeecPbFQVuQqcB6UYYcnxcXaFB6sQAcnYs4bhoRHPGUadFk1HBMH02","","https://www.rottentomatoes.com/profiles/K1ksARI60fo8SWXSQDHV5S2zSddc6otxoH5wszdFxxcj4tXnuDphmKFeecPbFQVuQqcB6UYYcnxcXaFB6sQAcnYs4bhoRHPGUadFk1HBMH02","Sep 20, 2023","the fuck,86!?
why is it 86!?"
"https://www.rottentomatoes.com/profiles/ePWsXdHX3I27FKbuz6SWwuMwSwwc3vs1oHbDUYXIKKcoPt89fQGcR7HmmcRgF3DUQMsnbFzzcVWc2WSYmfqvcoqh1kIqauY4t1LtRehwoH4k","C Wayne W","https://www.rottentomatoes.com/profiles/ePWsXdHX3I27FKbuz6SWwuMwSwwc3vs1oHbDUYXIKKcoPt89fQGcR7HmmcRgF3DUQMsnbFzzcVWc2WSYmfqvcoqh1kIqauY4t1LtRehwoH4k","Sep 18, 2023","This one had a real shot at redemption. It looked for a bit as if Rey might turn to the Dark Side and Kylo might redeem himself by returning to the Light Side. Would have been a much better, more original and unexpected turn of events. The Star Destroyer fleet looked great. Honestly, I only went because 1. the kids wanted to and 2. I started this journey when I was nine so I figured I should see it through, no matter the cost to my childhood memories."
"https://www.rottentomatoes.com/profiles/aOqFJGfo5um5tn2uV8ILnTWDcQQcVDiQEh1GUNjUKKcJBtB3CQPF0dSNNcopFaVc4khMahWWcbWcw8hRJFePINbhKwU9GFJYIx0IvQcqaUNY","James H","https://www.rottentomatoes.com/profiles/aOqFJGfo5um5tn2uV8ILnTWDcQQcVDiQEh1GUNjUKKcJBtB3CQPF0dSNNcopFaVc4khMahWWcbWcw8hRJFePINbhKwU9GFJYIx0IvQcqaUNY","Sep 18, 2023","So much potential wasted. Would've been far better if she had been a Palpatine as is her blood rather than this rubbish of her becoming a Skywalker, especially when Anakin was the only decent Skywalker character anyway. The way the characters of the Republic are just makes you want the Empire to win and come back to power and rid the galaxy of this nonsense. Would've been a better if Rey went to the dark side and her character probably would've become likeable. Shoddy storyline from the newest trilogy in my opinion and better writers are needed."
"https://www.rottentomatoes.com/profiles/XBXTDEsgxuzAuV8IABupBIYeTVVcN5FMeudPcMRHOOcNotoJteAFY1ceecj3h7oupaF2Rf11c8QiPKuAOIxecQ3cgefq5hQ8hJ8F7zug2upn","luniz 4","https://www.rottentomatoes.com/profiles/XBXTDEsgxuzAuV8IABupBIYeTVVcN5FMeudPcMRHOOcNotoJteAFY1ceecj3h7oupaF2Rf11c8QiPKuAOIxecQ3cgefq5hQ8hJ8F7zug2upn","Sep 15, 2023","I appreciate JJ Abrams' attempt to make a coherent story out of Rian Johnson's sludge filled disaster but the convoluted and creatively bankrupt ending fails to achieve satisfaction."
